{
  "schemaVersion": 1,
  "runId": "20261019T153838414Z",
  "collectorVersion": "0.1.0",
  "startedAt": "2026-10-19T15:38:38.414Z",
  "finishedAt": "2026-10-19T15:42:08.561Z",
  "targets": [
    {
      "targetKey": "apple:US:apps:top-free:all-apps",
      "target": {
        "store": "apple",
        "market": "US",
        "marketTimeZone": "America/New_York",
        "language": "en",
        "scope": "apps",
        "chart": "top-free",
        "normalizedCategory": "all-apps",
        "storeCategory": null,
        "expectedCount": 100,
        "publicationMode": "publish"
      },
      "status": "valid",
      "startedAt": "2026-10-19T15:38:38.417Z",
      "finishedAt": "2026-10-19T15:39:12.314Z",
      "attempts": 2,
      "snapshotPath": "snapshots/apple/US/apps/top-free/2026/10/19/20261019T153911055Z.json",
      "error": null,
      "flags": []
    },
    {
      "targetKey": "apple:US:apps:top-paid:all-apps",
      "target": {
        "store": "apple",
        "market": "US",
        "marketTimeZone": "America/New_York",
        "language": "en",
        "scope": "apps",
        "chart": "top-paid",
        "normalizedCategory": "all-apps",
        "storeCategory": null,
        "expectedCount": 100,
        "publicationMode": "publish"
      },
      "status": "valid",
      "startedAt": "2026-10-19T15:38:38.418Z",
      "finishedAt": "2026-10-19T15:39:12.365Z",
      "attempts": 1,
      "snapshotPath": "snapshots/apple/US/apps/top-paid/2026/10/19/20261019T153839462Z.json",
      "error": null,
      "flags": []
    },
    {
      "targetKey": "apple:US:games:top-free:all-games",
      "target": {
        "store": "apple",
        "market": "US",
        "marketTimeZone": "America/New_York",
        "language": "en",
        "scope": "games",
        "chart": "top-free",
        "normalizedCategory": "all-games",
        "storeCategory": "6014",
        "expectedCount": 100,
        "publicationMode": "publish"
      },
      "status": "valid",
      "startedAt": "2026-10-19T15:38:38.418Z",
      "finishedAt": "2026-10-19T15:39:12.285Z",
      "attempts": 1,
      "snapshotPath": "snapshots/apple/US/games/top-free/2026/10/19/20261019T153839480Z.json",
      "error": null,
      "flags": []
    },
    {
      "targetKey": "apple:US:games:top-paid:all-games",
      "target": {
        "store": "apple",
        "market": "US",
        "marketTimeZone": "America/New_York",
        "language": "en",
        "scope": "games",
        "chart": "top-paid",
        "normalizedCategory": "all-games",
        "storeCategory": "6014",
        "expectedCount": 100,
        "publicationMode": "publish"
      },
      "status": "partial",
      "startedAt": "2026-10-19T15:38:38.418Z",
      "finishedAt": "2026-10-19T15:39:12.298Z",
      "attempts": 1,
      "snapshotPath": "snapshots/apple/US/games/top-paid/2026/10/19/20261019T153839378Z.json",
      "error": null,
      "flags": [
        "count_below_expected:98/100"
      ]
    },
    {
      "targetKey": "google-play:US:apps:top-free:all-apps",
      "target": {
        "store": "google-play",
        "market": "US",
        "marketTimeZone": "America/New_York",
        "language": "en",
        "scope": "apps",
        "chart": "top-free",
        "normalizedCategory": "all-apps",
        "storeCategory": "APPLICATION",
        "expectedCount": 100,
        "publicationMode": "publish"
      },
      "status": "valid",
      "startedAt": "2026-10-19T15:38:38.418Z",
      "finishedAt": "2026-10-19T15:41:53.270Z",
      "attempts": 1,
      "snapshotPath": "snapshots/google-play/US/apps/top-free/2026/10/19/20261019T153838986Z.json",
      "error": null,
      "flags": []
    },
    {
      "targetKey": "google-play:US:apps:top-paid:all-apps",
      "target": {
        "store": "google-play",
        "market": "US",
        "marketTimeZone": "America/New_York",
        "language": "en",
        "scope": "apps",
        "chart": "top-paid",
        "normalizedCategory": "all-apps",
        "storeCategory": "APPLICATION",
        "expectedCount": 100,
        "publicationMode": "publish"
      },
      "status": "partial",
      "startedAt": "2026-10-19T15:38:38.418Z",
      "finishedAt": "2026-10-19T15:42:03.288Z",
      "attempts": 1,
      "snapshotPath": "snapshots/google-play/US/apps/top-paid/2026/10/19/20261019T153838922Z.json",
      "error": null,
      "flags": [
        "count_below_expected:91/100",
        "metadata_integrity:optional-section-parse"
      ]
    },
    {
      "targetKey": "google-play:US:apps:top-grossing:all-apps",
      "target": {
        "store": "google-play",
        "market": "US",
        "marketTimeZone": "America/New_York",
        "language": "en",
        "scope": "apps",
        "chart": "top-grossing",
        "normalizedCategory": "all-apps",
        "storeCategory": "APPLICATION",
        "expectedCount": 100,
        "publicationMode": "publish"
      },
      "status": "valid",
      "startedAt": "2026-10-19T15:38:38.419Z",
      "finishedAt": "2026-10-19T15:42:04.312Z",
      "attempts": 1,
      "snapshotPath": "snapshots/google-play/US/apps/top-grossing/2026/10/19/20261019T153838958Z.json",
      "error": null,
      "flags": []
    },
    {
      "targetKey": "google-play:US:games:top-free:all-games",
      "target": {
        "store": "google-play",
        "market": "US",
        "marketTimeZone": "America/New_York",
        "language": "en",
        "scope": "games",
        "chart": "top-free",
        "normalizedCategory": "all-games",
        "storeCategory": "GAME",
        "expectedCount": 100,
        "publicationMode": "publish"
      },
      "status": "valid",
      "startedAt": "2026-10-19T15:38:38.419Z",
      "finishedAt": "2026-10-19T15:41:58.303Z",
      "attempts": 1,
      "snapshotPath": "snapshots/google-play/US/games/top-free/2026/10/19/20261019T153839844Z.json",
      "error": null,
      "flags": [
        "metadata_integrity:optional-section-parse"
      ]
    },
    {
      "targetKey": "google-play:US:games:top-paid:all-games",
      "target": {
        "store": "google-play",
        "market": "US",
        "marketTimeZone": "America/New_York",
        "language": "en",
        "scope": "games",
        "chart": "top-paid",
        "normalizedCategory": "all-games",
        "storeCategory": "GAME",
        "expectedCount": 100,
        "publicationMode": "publish"
      },
      "status": "valid",
      "startedAt": "2026-10-19T15:38:38.419Z",
      "finishedAt": "2026-10-19T15:42:08.561Z",
      "attempts": 1,
      "snapshotPath": "snapshots/google-play/US/games/top-paid/2026/10/19/20261019T153839953Z.json",
      "error": null,
      "flags": [
        "metadata_integrity:optional-section-parse"
      ]
    },
    {
      "targetKey": "google-play:US:games:top-grossing:all-games",
      "target": {
        "store": "google-play",
        "market": "US",
        "marketTimeZone": "America/New_York",
        "language": "en",
        "scope": "games",
        "chart": "top-grossing",
        "normalizedCategory": "all-games",
        "storeCategory": "GAME",
        "expectedCount": 100,
        "publicationMode": "publish"
      },
      "status": "valid",
      "startedAt": "2026-10-19T15:38:38.420Z",
      "finishedAt": "2026-10-19T15:42:04.291Z",
      "attempts": 1,
      "snapshotPath": "snapshots/google-play/US/games/top-grossing/2026/10/19/20261019T153839862Z.json",
      "error": null,
      "flags": []
    }
  ]
}
