{
  "schemaVersion": 1,
  "runId": "20261023T230830710Z",
  "collectorVersion": "0.1.0",
  "startedAt": "2026-10-23T23:08:30.710Z",
  "finishedAt": "2026-10-23T23:09:36.274Z",
  "targets": [
    {
      "targetKey": "apple:CN:apps:top-free:all-apps",
      "target": {
        "store": "apple",
        "market": "CN",
        "marketTimeZone": "Asia/Shanghai",
        "language": "en",
        "scope": "apps",
        "chart": "top-free",
        "normalizedCategory": "all-apps",
        "storeCategory": null,
        "expectedCount": 100,
        "publicationMode": "publish"
      },
      "status": "valid",
      "startedAt": "2026-10-23T23:08:30.712Z",
      "finishedAt": "2026-10-23T23:09:36.237Z",
      "attempts": 1,
      "snapshotPath": "snapshots/apple/CN/apps/top-free/2026/10/24/20261023T230831930Z.json",
      "error": null,
      "flags": []
    },
    {
      "targetKey": "apple:CN:apps:top-paid:all-apps",
      "target": {
        "store": "apple",
        "market": "CN",
        "marketTimeZone": "Asia/Shanghai",
        "language": "en",
        "scope": "apps",
        "chart": "top-paid",
        "normalizedCategory": "all-apps",
        "storeCategory": null,
        "expectedCount": 100,
        "publicationMode": "publish"
      },
      "status": "valid",
      "startedAt": "2026-10-23T23:08:30.712Z",
      "finishedAt": "2026-10-23T23:09:36.274Z",
      "attempts": 3,
      "snapshotPath": "snapshots/apple/CN/apps/top-paid/2026/10/24/20261023T230935173Z.json",
      "error": null,
      "flags": []
    },
    {
      "targetKey": "apple:CN:games:top-free:all-games",
      "target": {
        "store": "apple",
        "market": "CN",
        "marketTimeZone": "Asia/Shanghai",
        "language": "en",
        "scope": "games",
        "chart": "top-free",
        "normalizedCategory": "all-games",
        "storeCategory": "6014",
        "expectedCount": 100,
        "publicationMode": "publish"
      },
      "status": "valid",
      "startedAt": "2026-10-23T23:08:30.713Z",
      "finishedAt": "2026-10-23T23:09:36.266Z",
      "attempts": 1,
      "snapshotPath": "snapshots/apple/CN/games/top-free/2026/10/24/20261023T230831473Z.json",
      "error": null,
      "flags": []
    },
    {
      "targetKey": "apple:CN:games:top-paid:all-games",
      "target": {
        "store": "apple",
        "market": "CN",
        "marketTimeZone": "Asia/Shanghai",
        "language": "en",
        "scope": "games",
        "chart": "top-paid",
        "normalizedCategory": "all-games",
        "storeCategory": "6014",
        "expectedCount": 100,
        "publicationMode": "publish"
      },
      "status": "valid",
      "startedAt": "2026-10-23T23:08:30.713Z",
      "finishedAt": "2026-10-23T23:09:36.255Z",
      "attempts": 1,
      "snapshotPath": "snapshots/apple/CN/games/top-paid/2026/10/24/20261023T230831451Z.json",
      "error": null,
      "flags": []
    }
  ]
}
