{
  "schemaVersion": 1,
  "runId": "20260930T013452675Z",
  "collectorVersion": "0.1.0",
  "startedAt": "2026-09-30T01:34:52.675Z",
  "finishedAt": "2026-09-30T01:37:27.057Z",
  "targets": [
    {
      "targetKey": "apple:IN:apps:top-free:all-apps",
      "target": {
        "store": "apple",
        "market": "IN",
        "marketTimeZone": "Asia/Kolkata",
        "language": "en",
        "scope": "apps",
        "chart": "top-free",
        "normalizedCategory": "all-apps",
        "storeCategory": null,
        "expectedCount": 100,
        "publicationMode": "publish"
      },
      "status": "valid",
      "startedAt": "2026-09-30T01:34:52.677Z",
      "finishedAt": "2026-09-30T01:34:55.485Z",
      "attempts": 1,
      "snapshotPath": "snapshots/apple/IN/apps/top-free/2026/09/30/20260930T013454353Z.json",
      "error": null,
      "flags": []
    },
    {
      "targetKey": "apple:IN:apps:top-paid:all-apps",
      "target": {
        "store": "apple",
        "market": "IN",
        "marketTimeZone": "Asia/Kolkata",
        "language": "en",
        "scope": "apps",
        "chart": "top-paid",
        "normalizedCategory": "all-apps",
        "storeCategory": null,
        "expectedCount": 100,
        "publicationMode": "publish"
      },
      "status": "partial",
      "startedAt": "2026-09-30T01:34:52.678Z",
      "finishedAt": "2026-09-30T01:34:55.419Z",
      "attempts": 1,
      "snapshotPath": "snapshots/apple/IN/apps/top-paid/2026/09/30/20260930T013453698Z.json",
      "error": null,
      "flags": [
        "count_below_expected:99/100"
      ]
    },
    {
      "targetKey": "apple:IN:games:top-free:all-games",
      "target": {
        "store": "apple",
        "market": "IN",
        "marketTimeZone": "Asia/Kolkata",
        "language": "en",
        "scope": "games",
        "chart": "top-free",
        "normalizedCategory": "all-games",
        "storeCategory": "6014",
        "expectedCount": 100,
        "publicationMode": "publish"
      },
      "status": "valid",
      "startedAt": "2026-09-30T01:34:52.678Z",
      "finishedAt": "2026-09-30T01:34:55.641Z",
      "attempts": 1,
      "snapshotPath": "snapshots/apple/IN/games/top-free/2026/09/30/20260930T013453572Z.json",
      "error": null,
      "flags": []
    },
    {
      "targetKey": "apple:IN:games:top-paid:all-games",
      "target": {
        "store": "apple",
        "market": "IN",
        "marketTimeZone": "Asia/Kolkata",
        "language": "en",
        "scope": "games",
        "chart": "top-paid",
        "normalizedCategory": "all-games",
        "storeCategory": "6014",
        "expectedCount": 100,
        "publicationMode": "publish"
      },
      "status": "partial",
      "startedAt": "2026-09-30T01:34:52.678Z",
      "finishedAt": "2026-09-30T01:34:55.445Z",
      "attempts": 1,
      "snapshotPath": "snapshots/apple/IN/games/top-paid/2026/09/30/20260930T013453546Z.json",
      "error": null,
      "flags": [
        "count_below_expected:99/100"
      ]
    },
    {
      "targetKey": "google-play:IN:apps:top-free:all-apps",
      "target": {
        "store": "google-play",
        "market": "IN",
        "marketTimeZone": "Asia/Kolkata",
        "language": "en",
        "scope": "apps",
        "chart": "top-free",
        "normalizedCategory": "all-apps",
        "storeCategory": "APPLICATION",
        "expectedCount": 100,
        "publicationMode": "publish"
      },
      "status": "valid",
      "startedAt": "2026-09-30T01:34:52.678Z",
      "finishedAt": "2026-09-30T01:37:18.920Z",
      "attempts": 1,
      "snapshotPath": "snapshots/google-play/IN/apps/top-free/2026/09/30/20260930T013454072Z.json",
      "error": null,
      "flags": []
    },
    {
      "targetKey": "google-play:IN:apps:top-paid:all-apps",
      "target": {
        "store": "google-play",
        "market": "IN",
        "marketTimeZone": "Asia/Kolkata",
        "language": "en",
        "scope": "apps",
        "chart": "top-paid",
        "normalizedCategory": "all-apps",
        "storeCategory": "APPLICATION",
        "expectedCount": 100,
        "publicationMode": "publish"
      },
      "status": "partial",
      "startedAt": "2026-09-30T01:34:52.678Z",
      "finishedAt": "2026-09-30T01:35:56.894Z",
      "attempts": 1,
      "snapshotPath": "snapshots/google-play/IN/apps/top-paid/2026/09/30/20260930T013452966Z.json",
      "error": null,
      "flags": [
        "count_below_expected:35/100",
        "metadata_integrity:optional-section-parse"
      ]
    },
    {
      "targetKey": "google-play:IN:apps:top-grossing:all-apps",
      "target": {
        "store": "google-play",
        "market": "IN",
        "marketTimeZone": "Asia/Kolkata",
        "language": "en",
        "scope": "apps",
        "chart": "top-grossing",
        "normalizedCategory": "all-apps",
        "storeCategory": "APPLICATION",
        "expectedCount": 100,
        "publicationMode": "publish"
      },
      "status": "valid",
      "startedAt": "2026-09-30T01:34:52.678Z",
      "finishedAt": "2026-09-30T01:37:26.365Z",
      "attempts": 1,
      "snapshotPath": "snapshots/google-play/IN/apps/top-grossing/2026/09/30/20260930T013453106Z.json",
      "error": null,
      "flags": []
    },
    {
      "targetKey": "google-play:IN:games:top-free:all-games",
      "target": {
        "store": "google-play",
        "market": "IN",
        "marketTimeZone": "Asia/Kolkata",
        "language": "en",
        "scope": "games",
        "chart": "top-free",
        "normalizedCategory": "all-games",
        "storeCategory": "GAME",
        "expectedCount": 100,
        "publicationMode": "publish"
      },
      "status": "valid",
      "startedAt": "2026-09-30T01:34:52.679Z",
      "finishedAt": "2026-09-30T01:37:26.025Z",
      "attempts": 1,
      "snapshotPath": "snapshots/google-play/IN/games/top-free/2026/09/30/20260930T013454023Z.json",
      "error": null,
      "flags": []
    },
    {
      "targetKey": "google-play:IN:games:top-paid:all-games",
      "target": {
        "store": "google-play",
        "market": "IN",
        "marketTimeZone": "Asia/Kolkata",
        "language": "en",
        "scope": "games",
        "chart": "top-paid",
        "normalizedCategory": "all-games",
        "storeCategory": "GAME",
        "expectedCount": 100,
        "publicationMode": "publish"
      },
      "status": "partial",
      "startedAt": "2026-09-30T01:34:52.679Z",
      "finishedAt": "2026-09-30T01:36:35.994Z",
      "attempts": 1,
      "snapshotPath": "snapshots/google-play/IN/games/top-paid/2026/09/30/20260930T013453029Z.json",
      "error": null,
      "flags": [
        "count_below_expected:54/100",
        "metadata_integrity:optional-section-parse"
      ]
    },
    {
      "targetKey": "google-play:IN:games:top-grossing:all-games",
      "target": {
        "store": "google-play",
        "market": "IN",
        "marketTimeZone": "Asia/Kolkata",
        "language": "en",
        "scope": "games",
        "chart": "top-grossing",
        "normalizedCategory": "all-games",
        "storeCategory": "GAME",
        "expectedCount": 100,
        "publicationMode": "publish"
      },
      "status": "valid",
      "startedAt": "2026-09-30T01:34:52.679Z",
      "finishedAt": "2026-09-30T01:37:27.057Z",
      "attempts": 1,
      "snapshotPath": "snapshots/google-play/IN/games/top-grossing/2026/09/30/20260930T013454142Z.json",
      "error": null,
      "flags": []
    }
  ]
}
