{
  "schemaVersion": 1,
  "runId": "20260929T140516418Z",
  "collectorVersion": "0.1.0",
  "startedAt": "2026-09-29T14:05:16.418Z",
  "finishedAt": "2026-09-29T14:08:16.219Z",
  "targets": [
    {
      "targetKey": "apple:BR:apps:top-free:all-apps",
      "target": {
        "store": "apple",
        "market": "BR",
        "marketTimeZone": "America/Sao_Paulo",
        "language": "en",
        "scope": "apps",
        "chart": "top-free",
        "normalizedCategory": "all-apps",
        "storeCategory": null,
        "expectedCount": 100,
        "publicationMode": "publish"
      },
      "status": "valid",
      "startedAt": "2026-09-29T14:05:16.420Z",
      "finishedAt": "2026-09-29T14:05:37.531Z",
      "attempts": 1,
      "snapshotPath": "snapshots/apple/BR/apps/top-free/2026/09/29/20260929T140535973Z.json",
      "error": null,
      "flags": []
    },
    {
      "targetKey": "apple:BR:apps:top-paid:all-apps",
      "target": {
        "store": "apple",
        "market": "BR",
        "marketTimeZone": "America/Sao_Paulo",
        "language": "en",
        "scope": "apps",
        "chart": "top-paid",
        "normalizedCategory": "all-apps",
        "storeCategory": null,
        "expectedCount": 100,
        "publicationMode": "publish"
      },
      "status": "quarantined",
      "startedAt": "2026-09-29T14:05:16.420Z",
      "finishedAt": "2026-09-29T14:05:37.113Z",
      "attempts": 1,
      "snapshotPath": "quarantine/apple/BR/apps/top-paid/2026/09/29/20260929T140535475Z.json",
      "error": null,
      "flags": [
        "count_below_expected:99/100",
        "suspicious_set_overlap:0.236"
      ]
    },
    {
      "targetKey": "google-play:BR:apps:top-free:all-apps",
      "target": {
        "store": "google-play",
        "market": "BR",
        "marketTimeZone": "America/Sao_Paulo",
        "language": "en",
        "scope": "apps",
        "chart": "top-free",
        "normalizedCategory": "all-apps",
        "storeCategory": "APPLICATION",
        "expectedCount": 100,
        "publicationMode": "publish"
      },
      "status": "valid",
      "startedAt": "2026-09-29T14:05:16.421Z",
      "finishedAt": "2026-09-29T14:08:10.218Z",
      "attempts": 1,
      "snapshotPath": "snapshots/google-play/BR/apps/top-free/2026/09/29/20260929T140517001Z.json",
      "error": null,
      "flags": []
    },
    {
      "targetKey": "google-play:BR:apps:top-paid:all-apps",
      "target": {
        "store": "google-play",
        "market": "BR",
        "marketTimeZone": "America/Sao_Paulo",
        "language": "en",
        "scope": "apps",
        "chart": "top-paid",
        "normalizedCategory": "all-apps",
        "storeCategory": "APPLICATION",
        "expectedCount": 100,
        "publicationMode": "publish"
      },
      "status": "partial",
      "startedAt": "2026-09-29T14:05:16.421Z",
      "finishedAt": "2026-09-29T14:06:17.134Z",
      "attempts": 1,
      "snapshotPath": "snapshots/google-play/BR/apps/top-paid/2026/09/29/20260929T140516721Z.json",
      "error": null,
      "flags": [
        "count_below_expected:22/100",
        "metadata_integrity:optional-section-parse"
      ]
    },
    {
      "targetKey": "google-play:BR:apps:top-grossing:all-apps",
      "target": {
        "store": "google-play",
        "market": "BR",
        "marketTimeZone": "America/Sao_Paulo",
        "language": "en",
        "scope": "apps",
        "chart": "top-grossing",
        "normalizedCategory": "all-apps",
        "storeCategory": "APPLICATION",
        "expectedCount": 100,
        "publicationMode": "publish"
      },
      "status": "valid",
      "startedAt": "2026-09-29T14:05:16.421Z",
      "finishedAt": "2026-09-29T14:08:05.255Z",
      "attempts": 1,
      "snapshotPath": "snapshots/google-play/BR/apps/top-grossing/2026/09/29/20260929T140516917Z.json",
      "error": null,
      "flags": []
    },
    {
      "targetKey": "google-play:BR:games:top-free:all-games",
      "target": {
        "store": "google-play",
        "market": "BR",
        "marketTimeZone": "America/Sao_Paulo",
        "language": "en",
        "scope": "games",
        "chart": "top-free",
        "normalizedCategory": "all-games",
        "storeCategory": "GAME",
        "expectedCount": 100,
        "publicationMode": "publish"
      },
      "status": "valid",
      "startedAt": "2026-09-29T14:05:16.421Z",
      "finishedAt": "2026-09-29T14:08:11.243Z",
      "attempts": 1,
      "snapshotPath": "snapshots/google-play/BR/games/top-free/2026/09/29/20260929T140517780Z.json",
      "error": null,
      "flags": []
    },
    {
      "targetKey": "google-play:BR:games:top-paid:all-games",
      "target": {
        "store": "google-play",
        "market": "BR",
        "marketTimeZone": "America/Sao_Paulo",
        "language": "en",
        "scope": "games",
        "chart": "top-paid",
        "normalizedCategory": "all-games",
        "storeCategory": "GAME",
        "expectedCount": 100,
        "publicationMode": "publish"
      },
      "status": "valid",
      "startedAt": "2026-09-29T14:05:16.421Z",
      "finishedAt": "2026-09-29T14:08:16.219Z",
      "attempts": 1,
      "snapshotPath": "snapshots/google-play/BR/games/top-paid/2026/09/29/20260929T140517801Z.json",
      "error": null,
      "flags": [
        "metadata_integrity:optional-section-parse"
      ]
    },
    {
      "targetKey": "google-play:BR:games:top-grossing:all-games",
      "target": {
        "store": "google-play",
        "market": "BR",
        "marketTimeZone": "America/Sao_Paulo",
        "language": "en",
        "scope": "games",
        "chart": "top-grossing",
        "normalizedCategory": "all-games",
        "storeCategory": "GAME",
        "expectedCount": 100,
        "publicationMode": "publish"
      },
      "status": "valid",
      "startedAt": "2026-09-29T14:05:16.421Z",
      "finishedAt": "2026-09-29T14:08:14.292Z",
      "attempts": 1,
      "snapshotPath": "snapshots/google-play/BR/games/top-grossing/2026/09/29/20260929T140517817Z.json",
      "error": null,
      "flags": []
    }
  ]
}
