{
  "schemaVersion": 1,
  "runId": "20260928T084217641Z",
  "collectorVersion": "0.1.0",
  "startedAt": "2026-09-28T08:42:17.641Z",
  "finishedAt": "2026-09-28T08:45:07.012Z",
  "targets": [
    {
      "targetKey": "apple:DE:apps:top-free:all-apps",
      "target": {
        "store": "apple",
        "market": "DE",
        "marketTimeZone": "Europe/Berlin",
        "language": "en",
        "scope": "apps",
        "chart": "top-free",
        "normalizedCategory": "all-apps",
        "storeCategory": null,
        "expectedCount": 100,
        "publicationMode": "publish"
      },
      "status": "valid",
      "startedAt": "2026-09-28T08:42:17.642Z",
      "finishedAt": "2026-09-28T08:42:52.059Z",
      "attempts": 1,
      "snapshotPath": "snapshots/apple/DE/apps/top-free/2026/09/28/20260928T084220653Z.json",
      "error": null,
      "flags": []
    },
    {
      "targetKey": "apple:DE:apps:top-paid:all-apps",
      "target": {
        "store": "apple",
        "market": "DE",
        "marketTimeZone": "Europe/Berlin",
        "language": "en",
        "scope": "apps",
        "chart": "top-paid",
        "normalizedCategory": "all-apps",
        "storeCategory": null,
        "expectedCount": 100,
        "publicationMode": "publish"
      },
      "status": "partial",
      "startedAt": "2026-09-28T08:42:17.643Z",
      "finishedAt": "2026-09-28T08:42:51.756Z",
      "attempts": 2,
      "snapshotPath": "snapshots/apple/DE/apps/top-paid/2026/09/28/20260928T084250788Z.json",
      "error": null,
      "flags": [
        "count_below_expected:99/100"
      ]
    },
    {
      "targetKey": "google-play:DE:apps:top-free:all-apps",
      "target": {
        "store": "google-play",
        "market": "DE",
        "marketTimeZone": "Europe/Berlin",
        "language": "en",
        "scope": "apps",
        "chart": "top-free",
        "normalizedCategory": "all-apps",
        "storeCategory": "APPLICATION",
        "expectedCount": 100,
        "publicationMode": "publish"
      },
      "status": "valid",
      "startedAt": "2026-09-28T08:42:17.643Z",
      "finishedAt": "2026-09-28T08:45:04.041Z",
      "attempts": 1,
      "snapshotPath": "snapshots/google-play/DE/apps/top-free/2026/09/28/20260928T084218040Z.json",
      "error": null,
      "flags": []
    },
    {
      "targetKey": "google-play:DE:apps:top-paid:all-apps",
      "target": {
        "store": "google-play",
        "market": "DE",
        "marketTimeZone": "Europe/Berlin",
        "language": "en",
        "scope": "apps",
        "chart": "top-paid",
        "normalizedCategory": "all-apps",
        "storeCategory": "APPLICATION",
        "expectedCount": 100,
        "publicationMode": "publish"
      },
      "status": "failed",
      "startedAt": "2026-09-28T08:42:17.643Z",
      "finishedAt": "2026-09-28T08:42:17.855Z",
      "attempts": 1,
      "snapshotPath": null,
      "error": {
        "kind": "google_play_error",
        "message": "ranking has 12 entries, below the minimum usable count"
      },
      "flags": []
    },
    {
      "targetKey": "google-play:DE:apps:top-grossing:all-apps",
      "target": {
        "store": "google-play",
        "market": "DE",
        "marketTimeZone": "Europe/Berlin",
        "language": "en",
        "scope": "apps",
        "chart": "top-grossing",
        "normalizedCategory": "all-apps",
        "storeCategory": "APPLICATION",
        "expectedCount": 100,
        "publicationMode": "publish"
      },
      "status": "valid",
      "startedAt": "2026-09-28T08:42:17.643Z",
      "finishedAt": "2026-09-28T08:45:07.012Z",
      "attempts": 1,
      "snapshotPath": "snapshots/google-play/DE/apps/top-grossing/2026/09/28/20260928T084218021Z.json",
      "error": null,
      "flags": []
    },
    {
      "targetKey": "google-play:DE:games:top-free:all-games",
      "target": {
        "store": "google-play",
        "market": "DE",
        "marketTimeZone": "Europe/Berlin",
        "language": "en",
        "scope": "games",
        "chart": "top-free",
        "normalizedCategory": "all-games",
        "storeCategory": "GAME",
        "expectedCount": 100,
        "publicationMode": "publish"
      },
      "status": "valid",
      "startedAt": "2026-09-28T08:42:17.643Z",
      "finishedAt": "2026-09-28T08:45:02.030Z",
      "attempts": 1,
      "snapshotPath": "snapshots/google-play/DE/games/top-free/2026/09/28/20260928T084219021Z.json",
      "error": null,
      "flags": []
    },
    {
      "targetKey": "google-play:DE:games:top-paid:all-games",
      "target": {
        "store": "google-play",
        "market": "DE",
        "marketTimeZone": "Europe/Berlin",
        "language": "en",
        "scope": "games",
        "chart": "top-paid",
        "normalizedCategory": "all-games",
        "storeCategory": "GAME",
        "expectedCount": 100,
        "publicationMode": "publish"
      },
      "status": "partial",
      "startedAt": "2026-09-28T08:42:17.643Z",
      "finishedAt": "2026-09-28T08:44:35.022Z",
      "attempts": 1,
      "snapshotPath": "snapshots/google-play/DE/games/top-paid/2026/09/28/20260928T084218941Z.json",
      "error": null,
      "flags": [
        "count_below_expected:63/100"
      ]
    },
    {
      "targetKey": "google-play:DE:games:top-grossing:all-games",
      "target": {
        "store": "google-play",
        "market": "DE",
        "marketTimeZone": "Europe/Berlin",
        "language": "en",
        "scope": "games",
        "chart": "top-grossing",
        "normalizedCategory": "all-games",
        "storeCategory": "GAME",
        "expectedCount": 100,
        "publicationMode": "publish"
      },
      "status": "valid",
      "startedAt": "2026-09-28T08:42:17.643Z",
      "finishedAt": "2026-09-28T08:45:06.987Z",
      "attempts": 1,
      "snapshotPath": "snapshots/google-play/DE/games/top-grossing/2026/09/28/20260928T084218966Z.json",
      "error": null,
      "flags": []
    }
  ]
}
